{
  "artifact_hash": "a7389cc123a544302b896c4c1ffc931a3c61c22318c0fa53c575cd1567d5fbfe",
  "artifact_type": "hai_official_distribution_metadata",
  "complete_file_inventory": [
    {
      "advertised_size_bytes": 4426,
      "creation_date": "2023-06-01T01:13:15.174Z",
      "file_type": "unknown",
      "name": "graph/boiler/dcs_1001h.json"
    },
    {
      "advertised_size_bytes": 953326,
      "creation_date": "2023-06-01T01:13:15.454Z",
      "file_type": "unknown",
      "name": "graph/boiler/dcs_1001h.png"
    },
    {
      "advertised_size_bytes": 7341,
      "creation_date": "2023-06-01T01:13:16.127Z",
      "file_type": "unknown",
      "name": "graph/boiler/dcs_1002h.json"
    },
    {
      "advertised_size_bytes": 1656891,
      "creation_date": "2023-06-01T01:13:16.223Z",
      "file_type": "unknown",
      "name": "graph/boiler/dcs_1002h.png"
    },
    {
      "advertised_size_bytes": 6199,
      "creation_date": "2023-06-01T01:13:16.221Z",
      "file_type": "unknown",
      "name": "graph/boiler/dcs_1003h.json"
    },
    {
      "advertised_size_bytes": 1338168,
      "creation_date": "2023-06-01T01:13:16.286Z",
      "file_type": "unknown",
      "name": "graph/boiler/dcs_1003h.png"
    },
    {
      "advertised_size_bytes": 14859,
      "creation_date": "2023-06-01T01:13:16.424Z",
      "file_type": "unknown",
      "name": "graph/boiler/dcs_1004h.json"
    },
    {
      "advertised_size_bytes": 3571928,
      "creation_date": "2023-06-01T01:13:16.3Z",
      "file_type": "unknown",
      "name": "graph/boiler/dcs_1004h.png"
    },
    {
      "advertised_size_bytes": 10344,
      "creation_date": "2023-06-01T01:13:16.221Z",
      "file_type": "unknown",
      "name": "graph/boiler/dcs_1010h.json"
    },
    {
      "advertised_size_bytes": 2902284,
      "creation_date": "2023-06-01T01:13:16.285Z",
      "file_type": "unknown",
      "name": "graph/boiler/dcs_1010h.png"
    },
    {
      "advertised_size_bytes": 10378,
      "creation_date": "2023-06-01T01:13:16.313Z",
      "file_type": "unknown",
      "name": "graph/boiler/dcs_1011h.json"
    },
    {
      "advertised_size_bytes": 2643475,
      "creation_date": "2023-06-01T01:13:16.293Z",
      "file_type": "unknown",
      "name": "graph/boiler/dcs_1011h.png"
    },
    {
      "advertised_size_bytes": 4041,
      "creation_date": "2023-06-01T01:13:16.343Z",
      "file_type": "unknown",
      "name": "graph/boiler/dcs_1020h.json"
    },
    {
      "advertised_size_bytes": 760238,
      "creation_date": "2023-06-01T01:13:16.338Z",
      "file_type": "unknown",
      "name": "graph/boiler/dcs_1020h.png"
    },
    {
      "advertised_size_bytes": 69621,
      "creation_date": "2023-06-01T01:13:16.359Z",
      "file_type": "unknown",
      "name": "graph/boiler/phy_boiler.json"
    },
    {
      "advertised_size_bytes": 813182,
      "creation_date": "2023-06-01T01:13:16.371Z",
      "file_type": "unknown",
      "name": "graph/boiler/phy_boiler.png"
    },
    {
      "advertised_size_bytes": 1284357,
      "creation_date": "2023-06-01T01:13:16.473Z",
      "file_type": "unknown",
      "name": "graph/graph_analysis.ipynb"
    },
    {
      "advertised_size_bytes": 121840298,
      "creation_date": "2023-06-01T01:13:20.161Z",
      "file_type": "unknown",
      "name": "hai-20.07/test1.csv"
    },
    {
      "advertised_size_bytes": 64007804,
      "creation_date": "2023-06-01T01:13:19.055Z",
      "file_type": "unknown",
      "name": "hai-20.07/test2.csv"
    },
    {
      "advertised_size_bytes": 130293220,
      "creation_date": "2023-06-01T01:13:21.218Z",
      "file_type": "unknown",
      "name": "hai-20.07/train1.csv"
    },
    {
      "advertised_size_bytes": 101031373,
      "creation_date": "2023-06-01T01:13:19.174Z",
      "file_type": "unknown",
      "name": "hai-20.07/train2.csv"
    },
    {
      "advertised_size_bytes": 23774845,
      "creation_date": "2023-06-01T01:13:18.412Z",
      "file_type": "unknown",
      "name": "hai-21.03/test1.csv"
    },
    {
      "advertised_size_bytes": 64866411,
      "creation_date": "2023-06-01T01:13:18.652Z",
      "file_type": "unknown",
      "name": "hai-21.03/test2.csv"
    },
    {
      "advertised_size_bytes": 59068199,
      "creation_date": "2023-06-01T01:13:18.848Z",
      "file_type": "unknown",
      "name": "hai-21.03/test3.csv"
    },
    {
      "advertised_size_bytes": 21605478,
      "creation_date": "2023-06-01T01:13:18.336Z",
      "file_type": "unknown",
      "name": "hai-21.03/test4.csv"
    },
    {
      "advertised_size_bytes": 50439655,
      "creation_date": "2023-06-01T01:13:18.477Z",
      "file_type": "unknown",
      "name": "hai-21.03/test5.csv"
    },
    {
      "advertised_size_bytes": 117962845,
      "creation_date": "2023-06-01T01:13:19.409Z",
      "file_type": "unknown",
      "name": "hai-21.03/train1.csv"
    },
    {
      "advertised_size_bytes": 123395361,
      "creation_date": "2023-06-01T01:13:19.138Z",
      "file_type": "unknown",
      "name": "hai-21.03/train2.csv"
    },
    {
      "advertised_size_bytes": 261779190,
      "creation_date": "2023-06-01T01:13:23.676Z",
      "file_type": "unknown",
      "name": "hai-21.03/train3.csv"
    },
    {
      "advertised_size_bytes": 2156,
      "creation_date": "2023-06-01T01:13:17.985Z",
      "file_type": "unknown",
      "name": "hai-22.04/summary/summary(test1.csv).txt"
    },
    {
      "advertised_size_bytes": 2744,
      "creation_date": "2023-06-01T01:13:17.956Z",
      "file_type": "unknown",
      "name": "hai-22.04/summary/summary(test2.csv).txt"
    },
    {
      "advertised_size_bytes": 2336,
      "creation_date": "2023-06-01T01:13:18.507Z",
      "file_type": "unknown",
      "name": "hai-22.04/summary/summary(test3.csv).txt"
    },
    {
      "advertised_size_bytes": 3154,
      "creation_date": "2023-06-01T01:13:18.465Z",
      "file_type": "unknown",
      "name": "hai-22.04/summary/summary(test4.csv).txt"
    },
    {
      "advertised_size_bytes": 1373,
      "creation_date": "2023-06-01T01:13:17.973Z",
      "file_type": "unknown",
      "name": "hai-22.04/summary/summary(train1.csv).txt"
    },
    {
      "advertised_size_bytes": 1374,
      "creation_date": "2023-06-01T01:13:18.469Z",
      "file_type": "unknown",
      "name": "hai-22.04/summary/summary(train2.csv).txt"
    },
    {
      "advertised_size_bytes": 1373,
      "creation_date": "2023-06-01T01:13:18.562Z",
      "file_type": "unknown",
      "name": "hai-22.04/summary/summary(train3.csv).txt"
    },
    {
      "advertised_size_bytes": 1373,
      "creation_date": "2023-06-01T01:13:18.534Z",
      "file_type": "unknown",
      "name": "hai-22.04/summary/summary(train4.csv).txt"
    },
    {
      "advertised_size_bytes": 1374,
      "creation_date": "2023-06-01T01:13:18.614Z",
      "file_type": "unknown",
      "name": "hai-22.04/summary/summary(train5.csv).txt"
    },
    {
      "advertised_size_bytes": 1374,
      "creation_date": "2023-06-01T01:13:18.516Z",
      "file_type": "unknown",
      "name": "hai-22.04/summary/summary(train6.csv).txt"
    },
    {
      "advertised_size_bytes": 50536532,
      "creation_date": "2023-06-01T01:13:19.533Z",
      "file_type": "unknown",
      "name": "hai-22.04/test1.csv"
    },
    {
      "advertised_size_bytes": 46616720,
      "creation_date": "2023-06-01T01:13:19.674Z",
      "file_type": "unknown",
      "name": "hai-22.04/test2.csv"
    },
    {
      "advertised_size_bytes": 35066591,
      "creation_date": "2023-06-01T01:13:19.614Z",
      "file_type": "unknown",
      "name": "hai-22.04/test3.csv"
    },
    {
      "advertised_size_bytes": 72931406,
      "creation_date": "2023-06-01T01:13:19.806Z",
      "file_type": "unknown",
      "name": "hai-22.04/test4.csv"
    },
    {
      "advertised_size_bytes": 53190281,
      "creation_date": "2023-06-01T01:13:19.347Z",
      "file_type": "unknown",
      "name": "hai-22.04/train1.csv"
    },
    {
      "advertised_size_bytes": 114199064,
      "creation_date": "2023-06-01T01:13:19.922Z",
      "file_type": "unknown",
      "name": "hai-22.04/train2.csv"
    },
    {
      "advertised_size_bytes": 69953332,
      "creation_date": "2023-06-01T01:13:19.643Z",
      "file_type": "unknown",
      "name": "hai-22.04/train3.csv"
    },
    {
      "advertised_size_bytes": 47917707,
      "creation_date": "2023-06-01T01:13:19.107Z",
      "file_type": "unknown",
      "name": "hai-22.04/train4.csv"
    },
    {
      "advertised_size_bytes": 131777589,
      "creation_date": "2023-06-01T01:13:24.809Z",
      "file_type": "unknown",
      "name": "hai-22.04/train5.csv"
    },
    {
      "advertised_size_bytes": 143438209,
      "creation_date": "2023-06-01T01:13:24.388Z",
      "file_type": "unknown",
      "name": "hai-22.04/train6.csv"
    },
    {
      "advertised_size_bytes": 31255559,
      "creation_date": "2023-06-01T01:13:23.519Z",
      "file_type": "unknown",
      "name": "hai-23.05/hai-test1.csv"
    },
    {
      "advertised_size_bytes": 132946575,
      "creation_date": "2023-06-01T01:13:25.543Z",
      "file_type": "unknown",
      "name": "hai-23.05/hai-test2.csv"
    },
    {
      "advertised_size_bytes": 162418984,
      "creation_date": "2023-06-01T01:13:25.983Z",
      "file_type": "unknown",
      "name": "hai-23.05/hai-train1.csv"
    },
    {
      "advertised_size_bytes": 169121615,
      "creation_date": "2023-06-01T01:13:26.107Z",
      "file_type": "unknown",
      "name": "hai-23.05/hai-train2.csv"
    },
    {
      "advertised_size_bytes": 72774793,
      "creation_date": "2023-06-01T01:13:23.632Z",
      "file_type": "unknown",
      "name": "hai-23.05/hai-train3.csv"
    },
    {
      "advertised_size_bytes": 114494940,
      "creation_date": "2023-06-01T01:13:23.839Z",
      "file_type": "unknown",
      "name": "hai-23.05/hai-train4.csv"
    },
    {
      "advertised_size_bytes": 1242017,
      "creation_date": "2023-06-01T01:13:22.92Z",